{
  "org": {
    "legalName": "Kulturbrücke Brandenburg e.V.",
    "localizedName": {
      "de": "Kulturbrücke Brandenburg",
      "ar": "جِسْر الثَّقَافَة"
    },
    "mosqueName": {
      "de": "Moschee Al Furqan",
      "ar": "مَسْجِد الفُرقان"
    },
    "address": {
      "street": "Mittelstraße 11",
      "postalCode": "14776",
      "city": "Brandenburg an der Havel",
      "country": "DE"
    },
    "registry": {
      "court": "Amtsgericht Potsdam",
      "number": "VR 8988 P"
    },
    "contactEmail": "kontakt@kulturbruecke-brandenburg.de",
    "donationsEmail": "kontakt@kulturbruecke-brandenburg.de",
    "phone": "PLATZHALTER"
  },
  "board": [
    { "role": "vorsitzender1", "representative": true, "name": "Mezdek Osman" },
    { "role": "vorsitzender2", "representative": true, "name": "Mohamad Nadim Tabateb" },
    { "role": "kassierer", "representative": true, "name": "Mohamad Najm" },
    { "role": "beisitzer1", "representative": false, "name": "Abdullah Shawerdi" },
    { "role": "beisitzer2", "representative": false, "name": "Yasser Al Haj Abdalwahab" }
  ],
  "bank": {
    "accountHolder": "Kulturbrücke Brandenburg e.V.",
    "iban": "DE65500105175445842768",
    "bic": "WELADED1PMB",
    "bankName": "Mittelbrandenburgische Sparkasse"
  },
  "donations": {
    "purposes": [{ "id": "general", "verwendungszweckTemplate": "SPENDE {year}" }],
    "taxNotice": {
      "taxOffice": "Finanzamt Brandenburg",
      "taxNumber": "048/141/00000"
    }
  },
  "prayerTimes": {
    "basePath": "content/prayer-times/",
    "iqamaOffsetMinutes": { "default": 15, "fajr": 25 }
  },
  "fridayPrayer": {
    "khutbahTime": "14:00"
  }
}
